{
  "$schema": "http://json-schema.org/draft-07/schema#",
  "$id": "https://alfred-v5.local/schemas/sam-drill-format.schema.json",
  "title": "SAM Song / Drill Document",
  "description": "Shape of a hand-authored or MCP-authored SAM song / drill document. Consumed by React (SongLoader) and by the Edge Function (append_sam_measures). See docs/technical-spec-sam-drills-and-lineage.md § 4.",
  "type": "object",
  "required": ["title", "measures"],
  "additionalProperties": true,
  "properties": {
    "title": { "type": "string", "minLength": 1 },
    "artist": { "type": ["string", "null"] },
    "songType": {
      "type": ["string", "null"],
      "enum": ["original", "simplified", "drill", null],
      "description": "Optional. Absent OR null means 'original' (preserves every pre-existing document). Null is accepted because an export emits every field it knows about, using null for 'this song has no value', rather than omitting keys."
    },
    "parentSongId": {
      "type": ["string", "null"],
      "description": "UUID of a parent song. Optional. `simplified` requires it; `drill` may or may not."
    },
    "difficultyTier": {
      "type": ["integer", "null"],
      "minimum": 1,
      "maximum": 9,
      "description": "Optional. Only meaningful when songType='simplified'."
    },
    "generationNotes": {
      "type": ["object", "null"],
      "description": "Receipt for human reading. Not source for a build step; derivation is a historical fact, not a live dependency."
    },
    "key": { "type": ["string", "null"] },
    "fifths": {
      "type": ["integer", "null"],
      "minimum": -7,
      "maximum": 7,
      "description": "MusicXML <fifths>. Authoritative key signature — `key` is a display label whose mode is unreliable (the parser derives it from a major-only table). Null when it could not be established without guessing."
    },
    "timeSignature": { "type": ["string", "null"], "description": "Song-level default, e.g. '4/4'. Per-measure timeSignature overrides." },
    "defaultBpm": { "type": ["number", "null"] },
    "goalBpm": {
      "type": ["integer", "null"],
      "minimum": 1,
      "description": "Goal tempo in tempo-box units (quarter notes per minute, like defaultBpm). Separate from defaultBpm, which is the practice tempo a song loads at. Null or absent = no goal specified: the database fills it from defaultBpm on insert, except that a simplified song inherits its parent's goal pair."
    },
    "goalPlaybackSpeed": {
      "type": ["integer", "null"],
      "minimum": 1,
      "description": "Playback speed percent paired with goalBpm (100 = full recording tempo). Only read when goalBpm is given; null or absent = 100."
    },
    "formatVersion": {
      "type": ["integer", "null"],
      "description": "Export format version. Absent / null == the original unversioned {title, artist, defaultBpm, measures} export. 2 adds key/fifths, lineage, sourceXmlPath, lyrics, fingerings, and an always-present per-measure audioOffsetMs. 3 adds goalBpm and goalPlaybackSpeed (always present, null when unknown)."
    },
    "sourceXmlPath": {
      "type": ["string", "null"],
      "description": "Path into the sam-scores Storage bucket holding the original MusicXML. Informational on import — no import path writes it; only a MusicXML upload populates the column."
    },
    "lyrics": {
      "type": "array",
      "description": "Placed (and unplaced) syllables, in sam_song_lyrics's own shape. Written back verbatim on import. word_order is the stable identity of a syllable and must be preserved across a round trip. measure_num null = not yet placed.",
      "items": { "$ref": "#/definitions/Lyric" }
    },
    "fingerings": {
      "type": "array",
      "description": "RH fingering cues for sam_song_fingerings. The parser emits these without `source` (all editorial); an export includes it so manual fingerings survive a round trip as manual.",
      "items": { "$ref": "#/definitions/Fingering" }
    },
    "measures": {
      "type": "array",
      "minItems": 1,
      "items": { "$ref": "#/definitions/Measure" }
    }
  },
  "definitions": {
    "Lyric": {
      "type": "object",
      "required": ["word_order", "syllable"],
      "additionalProperties": false,
      "properties": {
        "word_order": { "type": "integer", "minimum": 0, "description": "Global syllable sequence within the song. Unique per song." },
        "syllable": { "type": "string" },
        "measure_num": { "type": ["integer", "null"], "minimum": 1 },
        "rh_index": { "type": ["integer", "null"], "minimum": 0 }
      }
    },
    "Fingering": {
      "type": "object",
      "required": ["measureNum", "rhIndex", "finger"],
      "additionalProperties": false,
      "properties": {
        "measureNum": { "type": "integer", "minimum": 1 },
        "rhIndex": { "type": "integer", "minimum": 0 },
        "noteIndex": { "type": ["integer", "null"], "minimum": 0, "description": "Which notehead within a chord event. Defaults to 0." },
        "finger": { "type": "integer", "minimum": 1, "maximum": 5 },
        "source": { "type": "string", "enum": ["manual", "musicxml"], "description": "Defaults to 'musicxml' when absent (parser output)." }
      }
    },
    "Measure": {
      "type": "object",
      "required": ["rh", "lh", "timeSignature"],
      "additionalProperties": true,
      "not": {
        "required": ["beats"],
        "description": "beats[] is legacy and unsupported by sam_song_measures. Use rh[]/lh[]."
      },
      "properties": {
        "number": { "type": ["integer", "null"], "minimum": 1 },
        "timeSignature": { "$ref": "#/definitions/TimeSignature" },
        "chord": { "type": ["string", "null"] },
        "section": { "type": ["string", "null"] },
        "audioOffsetMs": { "type": ["number", "null"] },
        "rh": { "type": "array", "items": { "$ref": "#/definitions/VoiceEvent" } },
        "lh": { "type": "array", "items": { "$ref": "#/definitions/VoiceEvent" } }
      }
    },
    "TimeSignature": {
      "type": "object",
      "required": ["beats", "beatType"],
      "additionalProperties": false,
      "properties": {
        "beats": { "type": "integer", "minimum": 1 },
        "beatType": { "type": "integer", "enum": [1, 2, 4, 8, 16, 32] },
        "symbol": { "type": "string", "enum": ["common", "cut"] }
      }
    },
    "VoiceEvent": {
      "type": "object",
      "required": ["duration", "notes"],
      "additionalProperties": true,
      "not": {
        "required": ["lyric"],
        "description": "Authored documents must not carry inline lyric — recompileMeasures strips inline lyrics and re-injects from sam_song_lyrics. An authored lyric would vanish on first recompile."
      },
      "properties": {
        "duration": {
          "type": "string",
          "pattern": "^(w|h|q|8|16|32)d*$",
          "description": "VexFlow token: base note w/h/q/8/16/32 with optional 'd' per augmentation dot (hd, qd, 8d)."
        },
        "notes": {
          "type": "array",
          "items": { "$ref": "#/definitions/Note" },
          "noDuplicatePitches": true,
          "description": "Simultaneous pitches at this event's onset. Empty array [] means a rest. `noDuplicatePitches` is a custom Ajv keyword (registered by src/sam/lib/noteDuplicates.js and its Deno port): no two notes here may share a `midi` unless one is a tie continuation. Draft-07 cannot compare sibling array items, so the rule cannot be a plain constraint; a validator that does not know the keyword ignores it."
        },
        "tuplet": {
          "type": "object",
          "required": ["actual", "normal"],
          "additionalProperties": false,
          "properties": {
            "actual": { "type": "integer", "minimum": 1 },
            "normal": { "type": "integer", "minimum": 1 },
            "position": {
              "type": "string",
              "enum": ["start", "middle", "end"],
              "description": "OPTIONAL. Spec §3.3 keeps storage token-based — 'position stays implied in storage' — and durations.fromTimeline deliberately emits {actual, normal} only. Requiring it meant no parser-produced score containing a tuplet could pass this schema, so no such song could be exported and re-imported. Renderers derive position from a run of consecutive tuplet events."
            }
          }
        }
      }
    },
    "Note": {
      "type": "object",
      "required": ["midi", "name"],
      "additionalProperties": true,
      "properties": {
        "midi": {
          "type": "integer",
          "minimum": 0,
          "maximum": 127,
          "description": "(octave + 1) × 12 + step + alter. C4=60, A4=69."
        },
        "name": {
          "type": "string",
          "pattern": "^[A-G](##|bb|#|b)?-?[0-9]$",
          "description": "Display spelling: step, then optional accidental (# / b / ## / bb), then octave (-1..9). Examples: 'A4', 'Bb4', 'F#3', 'C-1'."
        },
        "tie": { "type": "string", "enum": ["start", "end", "both"] }
      }
    }
  }
}
