{
  "formatVersion": 2,
  "title": "The Scientist - Coldplay",
  "artist": null,
  "defaultBpm": 68,
  "key": "F major",
  "fifths": -1,
  "timeSignature": "4/4",
  "sourceXmlPath": "26f0707f-b586-4a3e-841c-8c313d6ab1e5/f3bb321f-aa95-4c73-bfdc-bdf3d36f8096.musicxml",
  "songType": "original",
  "parentSongId": null,
  "difficultyTier": null,
  "generationNotes": {
    "importer": {
      "importedAt": "2026-08-14T18:40:18.393Z",
      "parseWarnings": [
        "<metronome>: 5 occurrence(s) at printed m1, 21, 31, 51, 61 — carried on measure.carriedTags (presence recorded; full data extraction deferred until a renderer needs it, spec §M7).",
        "<slur>: 8 occurrence(s) at printed m8, 12, 16, 20, 38, 42, 46, 50 — carried on measure.carriedTags (presence recorded; full data extraction deferred until a renderer needs it, spec §M7)."
      ],
      "parseWarningsStructured": [
        {
          "tag": "metronome",
          "kind": "carried",
          "count": 5,
          "measures": [
            "1",
            "21",
            "31",
            "51",
            "61"
          ]
        },
        {
          "tag": "slur",
          "kind": "carried",
          "count": 8,
          "measures": [
            "8",
            "12",
            "16",
            "20",
            "38",
            "42",
            "46",
            "50"
          ]
        }
      ]
    },
    "playback": {
      "tempos": [
        {
          "bpm": 67.9998,
          "playIndex": 0,
          "beatOffset": 0
        },
        {
          "bpm": 67.9998,
          "playIndex": 4,
          "beatOffset": 0
        },
        {
          "bpm": 85.9998,
          "playIndex": 24,
          "beatOffset": 0
        },
        {
          "bpm": 67.9998,
          "playIndex": 34,
          "beatOffset": 0
        },
        {
          "bpm": 67.9998,
          "playIndex": 38,
          "beatOffset": 0
        },
        {
          "bpm": 85.9998,
          "playIndex": 58,
          "beatOffset": 0
        },
        {
          "bpm": 67.9998,
          "playIndex": 68,
          "beatOffset": 0
        }
      ],
      "playOrder": [
        0,
        1,
        2,
        3,
        0,
        1,
        2,
        3,
        4,
        5,
        6,
        7,
        8,
        9,
        10,
        11,
        12,
        13,
        14,
        15,
        16,
        17,
        18,
        19,
        20,
        21,
        22,
        23,
        24,
        25,
        26,
        27,
        28,
        29,
        30,
        31,
        32,
        33,
        30,
        31,
        32,
        33,
        34,
        35,
        36,
        37,
        38,
        39,
        40,
        41,
        42,
        43,
        44,
        45,
        46,
        47,
        48,
        49,
        50,
        51,
        52,
        53,
        54,
        55,
        56,
        57,
        58,
        59,
        60,
        61,
        62,
        63,
        64
      ],
      "structure": [
        {
          "repeats": [
            {
              "times": 2,
              "direction": "backward"
            }
          ],
          "sourceIdx": 3,
          "sourceAttr": "4"
        },
        {
          "repeats": [
            {
              "direction": "forward"
            }
          ],
          "sourceIdx": 30,
          "sourceAttr": "31"
        },
        {
          "repeats": [
            {
              "times": 2,
              "direction": "backward"
            }
          ],
          "sourceIdx": 33,
          "sourceAttr": "34"
        }
      ],
      "sourceCount": 65,
      "implicitFirst": false
    }
  },
  "lyrics": [],
  "fingerings": [],
  "measures": [
    {
      "lh": [
        {
          "notes": [
            {
              "midi": 50,
              "name": "D3"
            },
            {
              "midi": 53,
              "name": "F3"
            },
            {
              "midi": 57,
              "name": "A3"
            }
          ],
          "voice": "5",
          "duration": "q"
        },
        {
          "notes": [
            {
              "midi": 50,
              "name": "D3"
            },
            {
              "midi": 53,
              "name": "F3"
            },
            {
              "midi": 57,
              "name": "A3"
            }
          ],
          "voice": "5",
          "duration": "q"
        },
        {
          "notes": [
            {
              "midi": 50,
              "name": "D3"
            },
            {
              "midi": 53,
              "name": "F3"
            },
            {
              "midi": 57,
              "name": "A3"
            }
          ],
          "voice": "5",
          "duration": "q"
        },
        {
          "notes": [
            {
              "midi": 50,
              "name": "D3"
            },
            {
              "midi": 53,
              "name": "F3"
            },
            {
              "midi": 57,
              "name": "A3"
            }
          ],
          "voice": "5",
          "duration": "q"
        }
      ],
      "rh": [
        {
          "notes": [],
          "duration": "w"
        }
      ],
      "chord": null,
      "number": 1,
      "section": null,
      "sourceMeasure": "1",
      "timeSignature": {
        "beats": 4,
        "beatType": 4
      },
      "audioOffsetMs": null
    },
    {
      "lh": [
        {
          "notes": [
            {
              "midi": 50,
              "name": "D3"
            },
            {
              "midi": 53,
              "name": "F3"
            },
            {
              "midi": 58,
              "name": "Bb3"
            }
          ],
          "voice": "5",
          "duration": "q"
        },
        {
          "notes": [
            {
              "midi": 50,
              "name": "D3"
            },
            {
              "midi": 53,
              "name": "F3"
            },
            {
              "midi": 58,
              "name": "Bb3"
            }
          ],
          "voice": "5",
          "duration": "q"
        },
        {
          "notes": [
            {
              "midi": 50,
              "name": "D3"
            },
            {
              "midi": 53,
              "name": "F3"
            },
            {
              "midi": 58,
              "name": "Bb3"
            }
          ],
          "voice": "5",
          "duration": "q"
        },
        {
          "notes": [
            {
              "midi": 50,
              "name": "D3"
            },
            {
              "midi": 53,
              "name": "F3"
            },
            {
              "midi": 58,
              "name": "Bb3"
            }
          ],
          "voice": "5",
          "duration": "8"
        },
        {
          "notes": [
            {
              "midi": 60,
              "name": "C4"
            }
          ],
          "voice": "5",
          "duration": "8"
        }
      ],
      "rh": [
        {
          "notes": [],
          "duration": "w"
        }
      ],
      "chord": null,
      "number": 2,
      "section": null,
      "sourceMeasure": "2",
      "timeSignature": {
        "beats": 4,
        "beatType": 4
      },
      "audioOffsetMs": null
    },
    {
      "lh": [
        {
          "notes": [
            {
              "midi": 48,
              "name": "C3"
            },
            {
              "midi": 53,
              "name": "F3"
            },
            {
              "midi": 57,
              "name": "A3"
            }
          ],
          "voice": "5",
          "duration": "q"
        },
        {
          "notes": [
            {
              "midi": 48,
              "name": "C3"
            },
            {
              "midi": 53,
              "name": "F3"
            },
            {
              "midi": 57,
              "name": "A3"
            }
          ],
          "voice": "5",
          "duration": "q"
        },
        {
          "notes": [
            {
              "midi": 48,
              "name": "C3"
            },
            {
              "midi": 53,
              "name": "F3"
            },
            {
              "midi": 57,
              "name": "A3"
            }
          ],
          "voice": "5",
          "duration": "q"
        },
        {
          "notes": [
            {
              "midi": 48,
              "name": "C3"
            },
            {
              "midi": 53,
              "name": "F3"
            },
            {
              "midi": 57,
              "name": "A3"
            }
          ],
          "voice": "5",
          "duration": "q"
        }
      ],
      "rh": [
        {
          "notes": [],
          "duration": "w"
        }
      ],
      "chord": null,
      "number": 3,
      "section": null,
      "sourceMeasure": "3",
      "timeSignature": {
        "beats": 4,
        "beatType": 4
      },
      "audioOffsetMs": null
    },
    {
      "lh": [
        {
          "notes": [
            {
              "midi": 48,
              "name": "C3"
            },
            {
              "midi": 53,
              "name": "F3"
            },
            {
              "midi": 55,
              "name": "G3"
            }
          ],
          "voice": "5",
          "duration": "q"
        },
        {
          "notes": [
            {
              "midi": 48,
              "name": "C3"
            },
            {
              "midi": 53,
              "name": "F3"
            },
            {
              "midi": 55,
              "name": "G3"
            }
          ],
          "voice": "5",
          "duration": "q"
        },
        {
          "notes": [
            {
              "midi": 48,
              "name": "C3"
            },
            {
              "midi": 53,